Title; Link; Description
L'obligation fiscale de facturation;https://www.larcf.com/seekrcf/RcfPdf/fich_086_041.pdf;
Liste détaillée des Factures émises en suspension des ...;http://www.finances.gov.tn/sites/default/files/2019-08/suspension_taxe_ca.pdf;
Les factures d'achat Atelier 2 – Les éléments comptables de la ...;https://j4.cerpeg.fr/images/bcp_agora/atelier-apprendre/FacturesAchats/FacturesAchats_ATELIER2-CORRECTION.pdf;
depôt de la liste des bons de commandes et des factures d' ...;http://www.finances.gov.tn/sites/default/files/2019-08/cc_bon_commandes_new.pdf;
Les factures d'achat Atelier 1 – Les éléments comptables de la ...;https://j4.cerpeg.fr/images/bcp_agora/atelier-apprendre/FacturesAchats/FacturesAchats_ATELIER1-CORRECTION.pdf;
Exemple de description du processus règlement des factures ...;https://creg.ac-versailles.fr/IMG/pdf/v3_exemple_description_du_processus_de_traitement_des_factures.pdf;
facture.pdf - UML;https://www.labri.fr/perso/johnen/pdf/IUT-Bordeaux/UMLCours/facture.pdf;
son processus de traitement des factures fournisseurs;https://www.celge.fr/wp-content/uploads/2014/06/livre-blanc-2013-pourquoi-et-comment-automatiser-la-comptabilite-fournisseurs.pdf;
Chapitre 6 - Le droit de timbre;https://www.profiscal.com/etudiants/det/det_ch6_06.pdf;
Factures d'importation de produits alimentaires des pays ...;https://www.fao.org/3/y4852f/y4852f05.pdf;
ÉTAT RÉCAPITULATIF DES FACTURES;https://www.oise.gouv.fr/content/download/69462/421226/file/Etat%20r%C3%A9capitulatif%20des%20factures.pdf;
Conditions et modalités de paiement de nos factures;https://www.edqm.eu/documents/52006/58931/Conditions+et+modalit%C3%A9s+de++paiement+de+nos+factures.pdf/b50426d6-aac0-5cf5-65b6-456c320940e5?t=1650367119389;
Dématérialisation des factures et gestion comptable et ...;https://www.entreprises.gouv.fr/files/files/directions_services/numerique/guides/fiches-praTIC/fiche05.pdf;
TRAITEMENT DES FACTURES PDF;https://www.truecommerce.com/fr/wp-content/uploads/sites/5/2023/06/PDF-Invoice-Processing_new-logo_FR.pdf;
Factures B2B domestiques Les données requises;https://fnfe-mpe.org/wp-content/uploads/2022/12/2022-12-05-FNFE-MPE-FICHE-4-Les-donnees-obligatoires-VF.pdf;
Manuel de découverte Ciel Devis Factures;https://www.ciel.com/redirect.aspx?codet=ManDecWDF15;
INSTRUCTIONS POUR GÉRER LES FACTURES;https://www.sabic.com/en/Images/Manage-Invoices-French-vFinal_tcm1010-5755.pdf;
- Justificatifs des dépenses : Devis et Factures - Mayotte;https://daaf.mayotte.agriculture.gouv.fr/IMG/pdf/Definition_devis_et_factures_beneficiaires_cle03abaa-4.pdf;
Factures, contrats et bons de commande;https://www.oqlf.gouv.qc.ca/francisation/entreprises/memo-assistant-francisation/publications/fiche-factures-contrats-bons-commande.pdf;
TEDD.factures Traitement et envoi de factures électroniques;https://www.editionscompagnons.com/wp-content/uploads/2021/07/tedd-factures-fiche-produit.pdf;
Comment traiter les factures reçues et émettre des ...;https://communaute.chorus-pro.gouv.fr/wp-content/uploads/2023/01/Comment-traiter-les-factures-recues-et-emettre-des-factures-vers-une-autre-entite-publique.v2022.09.pdf;
Gestion documentaire des factures clients :;https://cloud.esker.fr/fm/others/003-EDW_White-Paper_Paystream-FR.pdf;
Tableau récapitulatif factures acquittées DETR;https://www.eure.gouv.fr/content/download/10094/58792/file/Tableau%20r;
Déposer une facture sur le Portail Chorus Pro;https://communaute.chorus-pro.gouv.fr/wp-content/uploads/2019/07/AIFE-Fiche-pratique-D%C3%A9poser-une-facture-2.0.pdf;
Portail e-Consult'Factures;https://medias.sncf.com/sncfcom/fournisseurs/Guide-utilisateur-portail.pdf;
facturation électronique - Présentation PowerPoint;https://www.impots.gouv.fr/sites/default/files/media/1_metier/2_professionnel/EV/2_gestion/290_facturation_electronique/support_de_presentation_specifications_externes_b2b_-_07122021.pdf;
Instructions pour un traitement optimal de vos factures;https://johncockerill.com/app/uploads/2021/11/Digitalisation-factures-Fiche-pratique-John-Cockerill.pdf;
Vos factures ne seront jamais aussi bien traitées !;https://lp.systhen.com/hubfs/logiciels/invoice-hub-by-yooz.pdf;
Exigences clés pour échanger les bons de commande et ...;https://www.solvay.com/sites/g/files/srpend221/files/2022-05/Exigences%20cl%C3%A9s%20pour%20%C3%A9changer%20les%20bons%20de%20commande%20et%20factures%20avec%20Solvay%20%284%29.pdf;
Accès fournisseurs- Consulter vos Factures;https://www.airproducts.com/-/media/files/en/supplier-information/supplier-web-invoice-and-payment-status-fr.pdf;
guide des bonnes pratiques de facturation;https://www.safran-group.com/fr/media/446150/download;
Paiement de factures (PDF);https://caissetech.com/wp-content/uploads/2023/07/paiement-factures.pdf;
FACTURATION FICTIVE OU DE COMPLAISANCE;https://www.economie.gouv.fr/files/files/directions_services/dgfip/controle_fiscal/procedes_fraude/6_Facturation_fictive_ou_de_complaisance.pdf;
Chorus Factures, solution de dématérialisation des ...;https://www.doubs.gouv.fr/contenu/telechargement/9423/57222/file/Chorus-factures-2-page;
DÉMATÉRIALISATION DES FACTURES FOURNISSEURS;https://www.edf.fr/sites/default/files/contrib/fournisseurs/demat-factures-fournisseurs.pdf;
GUIDE CHORUS FACTURES ENTREPRISES;https://www.morbihan.gouv.fr/content/download/16231/112153/file/DEPLIANT.pdf;
Comment payer en ligne et consulter ses factures ?;https://www.espace-citoyens.net/saint-fons/espace-citoyens/App_Ressources/fichiers_mairie/documents/Comment%20payer%20en%20ligne%20et%20consulter%20ses%20factures.pdf;
Exigences relatives à la présentation des factures;https://www.cargill.com/doc/1432154820276/invoice-submission-faq-north-america-fr.pdf;
FICHE 6;https://www.francenum.gouv.fr/files/Documents/Fiche_6__comment_mon_entreprise_va_recevoir_des_factures_electroniques.pdf;
Paiement de factures aux entreprises créancières RBC;https://www.rbcroyalbank.com/fr/entreprises/pdf/payer-et-recevoir/corpcredClientGuide.pdf;
Soumission des factures électroniques via PEPPOL;https://etendering.ted.europa.eu/document/document-file-download.html?docFileId=134308;
la facturation électronique pour les fournisseurs de ...;https://assets.rte-france.com/prod/public/2021-04/Information%20fournisseurs%20RTE%20-%20facturation%20electronique.pdf;
Impressions de factures;https://www.hapag-lloyd.com/content/dam/website/downloads/pdf/Imprimer_vous_factures.pdf;
LA DÉMATÉRIALISATION DES FACTURES;https://www.wavestone.com/app/uploads/2017/12/La-de%CC%81mate%CC%81rialisation-des-factures-fournisseurs.pdf;
Factures/fractures: de la notion de réseau à celle d'attachement;http://www.bruno-latour.fr/sites/default/files/76-FAKTURA-FR.pdf;
Tunisie - Decret gouvernemental n°2016-1066 du 15 aout ...;https://www.droit-afrique.com/uploads/Tunisie-Decret-2016-1066-emission-archivage-factures-electroniques.pdf;
Modèles de factures belges pour les associations;https://ctan.math.utah.edu/ctan/tex-archive/macros/latex/contrib/modeles-factures-belges-assocs/doc-modeles-factures-belges-assocs.pdf;
Mode opératoire Portail SY by Cegedim;https://www.grtgaz.com/sites/default/files/2020-12/Mode-operatoire-Portail-SY-Cegedim-GRTgaz.pdf;
Une application mobile pour payer ses factures d'eau;https://www.inbw.be/sites/default/files/publications/communique_de_presse_digiteal.pdf;
La dématérialisation des factures ...;https://www.collectivites-locales.gouv.fr/files/files/finances_locales/facturation/diaporama_cpp_sept2015.pdf;
Audit des processus de traitement des factures entrantes et ...;https://www.efk.admin.ch/images/stories/efk_dokumente/publikationen/andere_berichte/Andere%20Berichte%20(151)/16580BE.pdf;
Comment faire si vous avez du mal à payer vos factures ...;https://www.cieau.com/wp-content/uploads/2017/11/Brochure-FALC-Solidarite.pdf;
COMPRENDRE MES FACTURES;https://www.lausanne.ch/dam/jcr:ffa812e2-7b48-4ff7-be14-09ac0a390f38/comprendre-mes-factures-SiL.pdf;
COMMENT CRÉER UN DOSSIER DE FACTURE et ...;https://logiciel-enfance.fr/files/enfanceV2/Fiche%20pratique%208_gestion%20dossier%20de%20facture.pdf;
Comment simplifier la transmission de vos factures ?;https://help.dext.com/static/b7e0217436e49cf6ed2b765322588362/EXTERNE_Vierge.pdf;
Information importante à tous les fournisseurs du CICR;https://www.icrc.org/fr/download/file/26799/communication-to-supplier-icrc-2016-fre.pdf;
Guide de codification des factures de vente « Recettes »;https://services-numeriques.unistra.fr/fileadmin/upload/Services_numeriques/Documents/Documentations/Gestion_Finances/Guide_des_recettes_3.pdf;
CONSIGNES FACTURES FOURNISSEURS;https://cdn-group.bnpparibas.com/uploads/file/vendor_invoice_instructions_fr_v12.pdf;
Instructions de facturation pour le paiement rapide de vos ...;https://www.umicore.com/storage/main/instructions-de-facturation-umicore-france-fr-april-2020.pdf;
FOIRE AUX QUESTIONS Qu'est-ce que la facturation ...;https://www.tungsten-network.com/wp-content/uploads/2020/04/cat-all_fr_130315.pdf;
Lignes directrices concernant la présentation de factures ...;https://www.irmct.org/sites/default/files/documents/1511-guidelines-submission-hourly-invoices-remunerable-activities-190104-fr.pdf;
envoie-des-factures-par-e-mail.pdf;https://www.holcim.ch/sites/switzerland/files/2022-05/envoie-des-factures-par-e-mail.pdf;
Factures en format PDF - Social Security;https://socialsecurity.belgium.be/sites/default/files/content/docs/fr/elaboration-politique-sociale/plan-comptable/faq-201411-facture-fr.pdf;
Gérer ses factures Pro forma;https://www.chronopost.fr/sites/default/files/atoms/files/fiche_13_pro-forma.pdf;
charte facture;https://groupe-tf1.fr/sites/default/files/charte_facture_fournisseurs.pdf;
Aide à la facturation;https://www.glencore.com/dam/jcr:d6a3ff53-9955-43b0-868c-c5eebff83ee3/Coupa%20Facturation%20document%20de%20support_FR_FINAL_04.17.pdf;
Moyens de paiement des factures;https://pueblo.gpo.gov/CFPBPubs/pdfs/CFPBWEB123.pdf;
FAQ Fraude à la facture;https://economie.fgov.be/sites/default/files/Files/Entreprises/FAQ-fraudefacture.pdf;
Mandat pratique Contrôler les factures entrantes;https://www.swissbanking.ch/_Resources/Persistent/9/d/8/4/9d840d25a304572471594e7c5b69d0a5a376faba/Contr%C3%B4ler%20les%20factures%20entrantes.pdf;
Les factures et dépenses éligibles;https://www.franceagrimer.fr/content/download/72401/document/GUIDE%20DES%20BONNES%20PRATIQUES%20-%20LES%20FACTURES%20ET%20DEPENSES%20ELIGIBLES.pdf;
CACEM : LA DÉMATÉRIALISATION DE VOS FACTURES, ...;https://www.cacem.fr/wp-content/uploads/2022/11/Mitan-Eko-n%C2%B0-10-%E2%80%93-CACEM-La-dematerialisation-de-vos-factures-mode-demploi-%E2%80%93-Fevrier-2017.pdf;
Factures clients;https://www.d-booker.fr/GALERIE/public/doli/1102__livre_doli-services4E_ch16_factures_clients_debut.pdf;
Vérifier le statut de paiement des factures;https://procurement.ppg.com/getmedia/b50dab6b-bb2b-42fa-b40d-e724593e9c83/FR_QRG_Invoice-Payment-Status_Supplier.pdf;
Modèles de factures à adresser à vos clients professionnels;https://www.autoentrepreneur.urssaf.fr/portail/files/Facturier_AE.pdf;
Envoi de factures au format PDF et normes de qualité à ...;https://www.basf.com/global/documents/en/about-us/suppliers-and-partners/download-center/BASF_Letter_of_approval_for_PDF_invoices_FR.pdf.assetdownload.pdf;
Dématérialisation des factures d'achats;https://www.enedis.fr/media/2560/download;
Explication factures Aides TPE_C4-C2 - Total Energies;https://www.totalenergies.fr/fileadmin/Digital/Illustrations/TotalEnergies_Explication_factures_Aides_TPE_C4-C2.pdf;
Pour un traitement fluide de vos factures;https://www.strasbourg-electricite-reseaux.fr/file/11898;
DÉPOSEZ VOS FACTURES;https://www.uniformation.fr/sites/default/files/files/Guide%20utilisateur%20espace%20apprentissage%20CFA%20-%20Uniformation.pdf;
Dématérialisez vos factures clients;https://www.bureautique-solutions.com/wp-content/uploads/sites/18/2021/11/labs-open-bee-facture-client-fr.pdf;
Démarrer simplement la facturation - Sage BOB;https://sagebob50.online-help.sage.fr/wp-static-content/whitepapers/fr_FR/b50v410cgp-d%C3%A9marrer%20simplement%20la%20facturation-1312.pdf;
Déposer une facture;https://www.akto.fr/content/uploads/2022/09/Tuto-depot-facture-MonEspace-externe.pdf;
Les factures;http://astuces.logosw.net/DossiersLOGOS/Dossier%20patient/Factures.pdf;
« FORMULAIRE TYPE – FACTURES »;https://www.ecologie.gouv.fr/sites/default/files/4d_-_formulaire_type_factures_-_atteinte_d_une_performance_energetique_globale_minimale_-_outre-mer.pdf;
Dématérialisation des factures des fournisseurs du secteur ...;https://www.cnrs.fr/sites/default/files/page/2023-03/BrochureCNRSChorusProVF2023.pdf;
Logiciels PROGIDOC Factures;https://www.provea.eu/wp-content/uploads/2022/06/202205_dematerialisation-factures-fournisseurs.pdf;
Guide de l'utilisateur DHL MyBill;https://mydhl.express.dhl/content/dam/downloads/gp/fr/electronic-billing/dhl_mybill_userguide_faqs_gp_fr.pdf.coredownload.pdf;
FAQ Invoicing_FR;https://www.agc-glass.eu/sites/default/files/2021-04/FAQ-Invoicing-FR.pdf;
mode d'emploi pour compléter vos factures commerciales;https://www.ups.com/assets/resources/media/fr_FR/Commercial-Invoice-Guide.pdf;
Automatisation sécurisée du traitement des factures avec ...;https://www.xerox.com/downloads/fra/fr/services/document/accounts-payable-brief.pdf;
Dématérialisation des factures;https://static3.cegos.fr/content/uploads/2020/07/23181026/Reference-client-grtgaz-web.pdf;
PROCEDURE D'EDITION DE FACTURE NORMALISEE;https://www.dgi.gouv.ci/assets/documents/FACTURE%20NORMALISE%CC%81E.pdf;
Rappel des modalités d'envoi de vos facture à la Ville de ...;https://www.bourgenbresse.fr/cms_viewFile.php?idtf=2817&path=Rappel-des-modalites-d-envoi-de-vos-facture-a-la-Ville-de-Bourg-en-Bresse.pdf;
Émission de factures par les fournisseurs de marchandises ...;https://autogrill.ch/sites/atgcountrych/files/cgv_emission_de_factures.pdf;
Téléchargement de vos factures;https://www.partslink24.com/partslink24_media/faq/invoice_fr.pdf;
La dématérialisation des factures des fournisseurs ...;https://www.enib.fr/files/finances/2016-plaquette-fournisseur.pdf;
PRINCIPES RÉGISSANT LES FACTURES FOURNISSEURS;https://www.westrock.com/-/media/pdf/supplier-resources/westrock-invoice-requirements-french-pdf.pdf;
Télétransmission Chorus Pro - Dématérialisation des factures;https://www.ebp.com/wp-content/uploads/2021/10/ebp-teletransmission-chorus-pro-10-2021.pdf;
